{
  "blockers": [],
  "model_id": "M6",
  "next_action": "Provide base_audit input, then run risk/dashboard/PQA stages.",
  "pipeline_result": {
    "blockers": [],
    "dashboard_card": null,
    "data_audit": {
      "benchmark_etf": [
        "XLV",
        "IHF"
      ],
      "benchmark_status": "Present",
      "buy_zone_high": 14.0,
      "buy_zone_low": 12.0,
      "buy_zone_status": "Above Buy Zone",
      "current_price": 15.4,
      "data_quality": "Usable",
      "decision_blockers": [],
      "eps_guidance_midpoint": 0.28,
      "forward_pe": 54.99999999999999,
      "gap_to_buy_zone_pct": 10.000000000000002,
      "model_id": "M6",
      "next_action": "Proceed to risk review",
      "price_as_of": "2026-05-16",
      "price_freshness_status": "Fresh",
      "stale_price": false,
      "ticker": "HIMS",
      "valuation_status": "Computed"
    },
    "memory_check": {
      "failures": [],
      "missing_context_keys": [],
      "next_action": "Proceed: required memory context is complete, fresh, and supported.",
      "passed": true,
      "severity": "Pass",
      "stale_context_keys": [],
      "unsupported_model_ids": [],
      "warnings": []
    },
    "model_id": "M6",
    "next_action": "Provide base_audit input, then run risk/dashboard/PQA stages.",
    "pipeline_status": "Needs Audit",
    "pqa_report": null,
    "research_summary": {
      "balance_sheet": "Missing Data",
      "bear_case": [],
      "bull_case": [],
      "evidence_quality": "Missing Data",
      "growth_drivers": [],
      "kill_switches": [],
      "missing_data": [
        "sec_10k_or_annual_report",
        "sec_10q_or_quarterly_report",
        "latest_earnings_release",
        "latest_earnings_call_transcript",
        "investor_presentation",
        "current_price_and_market_data",
        "fda_and_regulatory_updates",
        "product_and_pipeline_progress",
        "reimbursement_and_payer_risk",
        "safety_and_litigation_exposure"
      ],
      "moat": "Missing Data",
      "model_estimates": [],
      "model_id": "M6",
      "next_action": "Collect and verify required sources before audit decision.",
      "preliminary_decision": "Wait",
      "profitability_quality": "Missing Data",
      "source_checklist": [
        {
          "required": true,
          "source_type": "sec_10k_or_annual_report",
          "tier": "primary",
          "why_needed": "Anchor long-term fundamentals, risks, and accounting disclosures."
        },
        {
          "required": true,
          "source_type": "sec_10q_or_quarterly_report",
          "tier": "primary",
          "why_needed": "Capture latest quarter operating trends and balance-sheet updates."
        },
        {
          "required": true,
          "source_type": "latest_earnings_release",
          "tier": "primary",
          "why_needed": "Confirm reported results, guidance, and management commentary."
        },
        {
          "required": true,
          "source_type": "latest_earnings_call_transcript",
          "tier": "primary",
          "why_needed": "Validate qualitative signals, Q&A details, and management tone."
        },
        {
          "required": true,
          "source_type": "investor_presentation",
          "tier": "secondary",
          "why_needed": "Cross-check segment KPIs and strategic priorities highlighted to investors."
        },
        {
          "required": true,
          "source_type": "current_price_and_market_data",
          "tier": "primary",
          "why_needed": "Support valuation discipline, benchmark-relative checks, and freshness control."
        },
        {
          "required": true,
          "source_type": "fda_and_regulatory_updates",
          "tier": "primary",
          "why_needed": "Track approvals, warnings, and filing status changes."
        },
        {
          "required": true,
          "source_type": "product_and_pipeline_progress",
          "tier": "primary",
          "why_needed": "Verify launch momentum and clinical milestone execution."
        },
        {
          "required": true,
          "source_type": "reimbursement_and_payer_risk",
          "tier": "secondary",
          "why_needed": "Test pricing durability, coverage expansion, and access risk."
        },
        {
          "required": true,
          "source_type": "safety_and_litigation_exposure",
          "tier": "secondary",
          "why_needed": "Identify label, adverse-event, and legal downside tail risk."
        }
      ],
      "ticker": "HIMS",
      "valuation": "Missing Data",
      "verified_facts": [],
      "weak_signals": []
    },
    "risk_adjusted_audit": null,
    "source_requirements": {
      "model_id": "M6",
      "source_requirements": [
        {
          "required": true,
          "source_type": "sec_10k_or_annual_report",
          "tier": "primary",
          "why_needed": "Anchor long-term fundamentals, risks, and accounting disclosures."
        },
        {
          "required": true,
          "source_type": "sec_10q_or_quarterly_report",
          "tier": "primary",
          "why_needed": "Capture latest quarter operating trends and balance-sheet updates."
        },
        {
          "required": true,
          "source_type": "latest_earnings_release",
          "tier": "primary",
          "why_needed": "Confirm reported results, guidance, and management commentary."
        },
        {
          "required": true,
          "source_type": "latest_earnings_call_transcript",
          "tier": "primary",
          "why_needed": "Validate qualitative signals, Q&A details, and management tone."
        },
        {
          "required": true,
          "source_type": "investor_presentation",
          "tier": "secondary",
          "why_needed": "Cross-check segment KPIs and strategic priorities highlighted to investors."
        },
        {
          "required": true,
          "source_type": "current_price_and_market_data",
          "tier": "primary",
          "why_needed": "Support valuation discipline, benchmark-relative checks, and freshness control."
        },
        {
          "required": true,
          "source_type": "fda_and_regulatory_updates",
          "tier": "primary",
          "why_needed": "Track approvals, warnings, and filing status changes."
        },
        {
          "required": true,
          "source_type": "product_and_pipeline_progress",
          "tier": "primary",
          "why_needed": "Verify launch momentum and clinical milestone execution."
        },
        {
          "required": true,
          "source_type": "reimbursement_and_payer_risk",
          "tier": "secondary",
          "why_needed": "Test pricing durability, coverage expansion, and access risk."
        },
        {
          "required": true,
          "source_type": "safety_and_litigation_exposure",
          "tier": "secondary",
          "why_needed": "Identify label, adverse-event, and legal downside tail risk."
        }
      ],
      "ticker": "HIMS"
    },
    "ticker": "HIMS"
  },
  "pipeline_status": "Needs Audit",
  "run_date": "2026-05-16",
  "run_id": "manual-20260516-175211",
  "ticker": "HIMS"
}
